{
  "$schema": "http://json-schema.org/draft-07/schema#",
  "title": "Region Schema",
  "description": "Defines the structure for any regional override in PixelVault Earth",
  "type": "object",
  "properties": {
    "region_name": {
      "type": "string",
      "description": "Name of the region or country, e.g., 'Sweden' or 'Rwanda'"
    },
    "tone": {
      "type": "string",
      "description": "Narrative tone for this region (e.g., gritty thriller, hopepunk)"
    },
    "tech_level": {
      "type": "string",
      "description": "Technology status in this region"
    },
    "elevation": {
      "type": "string",
      "description": "Geographic elevation detail if relevant (e.g., highland safe zone)"
    },
    "infrastructure": {
      "type": "array",
      "items": { "type": "string" },
      "description": "Key infrastructures like solar, water, road systems"
    },
    "problems": {
      "type": "array",
      "items": { "type": "string" },
      "description": "Regional concerns (e.g., rising sea, refugee pressure)"
    },
    "youth_trends": {
      "type": "array",
      "items": { "type": "string" },
      "description": "Popular subcultures, social tech uses, etc."
    },
    "notes": {
      "type": "string",
      "description": "Freeform notes about the region"
    }
  },
  "required": ["region_name", "tone"]
}
